<?xml version="1.0" encoding="UTF-8"?>
<city xmlns="http://www.example.org/Schema" 
	xmlns:xsi="http://www.w3.org/2001/XMLSchema-instance" 
	xsi:schemaLocation="http://www.example.org/Schema Schema.xsd " 
	id="2520058"
	updatedOn="2012-03-04">
	<name>Cartagena</name>
	<country>Spain</country>
	<population>211966</population>
	<position>
		<lat>37.60512</lat>
		<lng>-0.98623</lng>
	</position>
	<urlBDpedia>http://dbpedia.org/resource/Cartagena%2C_Spain</urlBDpedia>
	<urlWikipedia>https://en.wikipedia.org/wiki/Cartagena%2C_Spain</urlWikipedia>
	<meteoInfo takenOn="2019-02-04T12:00:00">
		<stationName>International airport of the Region of Murcia</stationName>
		<temperature>13</temperature>
		<clouds>clouds and visibility OK</clouds>
	</meteoInfo>
	<interestPlace>
		<name>Parque Maestranza de Artilleria</name>
		<id>10860321</id>
	</interestPlace>
	<interestPlace>
		<name>Museo Hist√≥rico Militar de Cartagena</name>
		<id>10280776</id>
	</interestPlace>
</city>
