<?xml version="1.0" ?>
<city xmlns="http://www.example.org/Schema"
	xmlns:xsi="http://www.w3.org/2001/XMLSchema-instance"
	xsi:schemaLocation="http://www.example.org/Schema Schema.xsd "
	updatedOn="2018-04-20">
	<name>Cartagena</name>
	<geonamesid>3687238</geonamesid>
	<country>M</country>
	<population>952024</population>
	<position>
		<lat>10.39972</lat>
		<lng>-75.51444</lng>
	</position>
	<urlBDpedia>http://dbpedia.org/resource/Cartagena%2C_Colombia</urlBDpedia>
	<urlWikipedia>https://en.wikipedia.org/wiki/Cartagena%2C_Colombia</urlWikipedia>
	<meteoInfo takenOn="2019-03-30T11:00:00">
		<stationName>Cartagena / Rafael Nunez</stationName>
		<temperature>28.0</temperature>
		<clouds>few clouds</clouds>
	</meteoInfo>
	<interestPlace>
		<name>Acueducto Cartagena</name>
		<id>3687237</id>
	</interestPlace>
	<interestPlace>
		<name>Barrio El Prado</name>
		<id>3689126</id>
	</interestPlace>
	<interestPlace>
		<name>Amberes</name>
		<id>3689976</id>
	</interestPlace>
	<interestPlace>
		<name>Armenia</name>
		<id>3689554</id>
	</interestPlace>
	<interestPlace>
		<name>Bruselas</name>
		<id>3688474</id>
	</interestPlace>
	<interestPlace>
		<name>Movich Hotel Cartagena De Indias Slh</name>
		<id>9612088</id>
	</interestPlace>
	<interestPlace>
		<name>Cartagena Water Treatment Plant</name>
		<id>9222770</id>
	</interestPlace>
	<interestPlace>
		<name>Lomas de Mariï¿½n</name>
		<id>3675258</id>
	</interestPlace>
	<interestPlace>
		<name>Hotel Avenida Buenos Aires</name>
		<id>10233251</id>
	</interestPlace>
</city>